id,Year,Category,Nominee
1,1959.0,Album of the Year,The Music from Peter Gunn.
2,1959.0,Best Album Cover,Only the Lonely
3,1959.0,Best Arrangement,The Music From Peter Gunn
4,1959.0,Best Classical Performance - Chamber Music (including Chamber Orchestra),Beethoven: Quartet 130
5,1959.0,Best Classical Performance - Instrumentalist (other than Concerto Scale Accompaniment),Segovia Golden Jubilee
6,1959.0,Best Classical Performance - Instrumentalist (other than concerto-scale accompaniment),Segovia Golden Jubilee
7,1959.0,Best Classical Performance - Instrumentalist (with Concerto Scale Accompaniment),"Tchaikovsky: Piano Concerto No. 1 In B Flat Minor, Op. 23"
8,1959.0,Best Classical Performance - Operatic or Choral,Virtuoso
9,1959.0,Best Classical Performance - Orchestra,Gaiete Parisienne
10,1959.0,Best Classical Performance - Vocal Soloist (with or without Orchestra),Operatic Recital
11,1959.0,Best Comedy Performance,The Chipmunk Song
12,1959.0,Best Country & Western Performance,Tom Dooley
13,1959.0,Best Country and Western Performance,Tom Dooley.
14,1959.0,Best Engineered Record (Classical),Duets with a Spanish Guitar
15,1959.0,Best Engineered Record - Non-Classical,The Chipmunk Song
16,1959.0,Best Instrumental Arrangement,The Music from Peter Gunn.
17,1959.0,Best Instrumental Composition,Cross Country Suite.
18,1959.0,"Best Jazz Performance, Group",Basie.
19,1959.0,"Best Jazz Performance, Individual",Ella Fitzgerald Sings the Duke Ellington Songbook.
20,1959.0,Best Musical Composition First Recorded and Released in 1958 (over 5 minutes duration),Cross Country Suite
21,1959.0,Best Original Cast Album (Broadway or TV),The Music Man
22,1959.0,Best Performance by a Dance Band,Basie
23,1959.0,Best Performance by a Vocal Group or Chorus,That Old Black Magic
24,1959.0,Best Performance by an Orchestra - for Other Than Dancing,Billy May's Big Fat Brass
25,1959.0,"Best Performance, Documentary or Spoken Word",The Best Of The Stan Freberg Shows
26,1959.0,Best R&B Vocal Performance by a Duo or Group,Tequila
27,1959.0,Best Recording for Children,The Chipmunk Song (Christmas Don't Be Late)
28,1959.0,Best Rhythm & Blues Performance,Tequila
29,1959.0,"Best Sound Track Album, Dramatic Picture Score or Original Cast",Gigi
30,1959.0,"Best Soundtrack Album, Dramatic Picture Score or Original Cast",Gigi
31,1959.0,"Best Vocal Performance, Female",Ella Fitzgerald
32,1959.0,"Best Vocal Performance, Male",Perry Como
33,1959.0,Record of the Year,Nel Blu Dipinto di Blu (Volare).
34,1959.0,Song of the Year,Nel Blu Dipinto di Blu (Volare).
35,1961.0,Album of the Year,The Button-Down Mind of Bob Newhart
36,1961.0,Best Album Cover,Latin A La Lee.
37,1961.0,Best Album Created For Children,Let's All Sing With The Chipmunks.
38,1961.0,Best Arrangement,Mr. Lucky.
39,1961.0,Best Classical Opera Production,Puccini: Turandot.
40,1961.0,Best Classical Performance - Vocal Or Instrumental - Chamber Music,Conversations With The Guitar.
41,1961.0,Best Classical Performance- Choral (Including Oratorio),Handel: Messiah.
42,1961.0,Best Classical Performance- Concerto Or Instrumental Soloist,Brahms: Piano Concerto No. 2 In B Flat.
43,1961.0,Best Classical Performance- Instrumental Soloist Or Duo (Other Than With Orchestral Accompaniment),The Spanish Guitars Of Laurindo Almeida.
44,1961.0,Best Classical Performance- Orchestra,"Bartók: Music For Strings, Percussion And Celeste."
45,1961.0,Best Classical Performance- Vocal Soloist,A Program Of Song - Leontyne Price Recital.
46,1961.0,Best Comedy Performance - Musical,Jonathan And Darlene Edwards In Paris.
47,1961.0,Best Comedy Performance - Spoken Word,The Button-Down Mind Strikes Back!.
48,1961.0,Best Contemporary Classical Composition,Copland: Orchestral Suite From Tender Land Suite.
49,1961.0,Best Country & Western Performance,El Paso.
50,1961.0,Best Engineering Contribution - Classical Recording,The Spanish Guitars Of Laurindo Almeida.
51,1961.0,Best Engineering Contribution - Novelty Recording,The Old Payola Roll Blues.
52,1961.0,Best Engineering Contribution - Popular Recording,Ella Fitzgerald Sings The George And Ira Gershwin Songbook.
53,1961.0,Best Jazz Composition Of More Than Five Minutes Duration,Sketches Of Spain.
54,1961.0,Best Jazz Performance Large Group,Blues And The Beat.
55,1961.0,Best Jazz Performance Solo or Small Group,West Side Story.
56,1961.0,Best New Artist,Bob Newhart
57,1961.0,Best Performance By A Pop Single Artist,Georgia On My Mind.
58,1961.0,Best Performance by a Band For Dancing,Dance With Basie.
59,1961.0,Best Performance by a Chorus (7 Or More Persons),Songs Of The Cowboy.
60,1961.0,Best Performance by a Vocal Group (2 To 6),We Got Us.
61,1961.0,Best Performance by an Orchestra,Mr. Lucky.
62,1961.0,Best Performance- Documentary or Spoken Word (Other Than Comedy),FDR Speaks.
63,1961.0,Best Performance- Folk,Swing Dat Hammer.
64,1961.0,Best Rhythm & Blues Performance,Let The Good Times Roll.
65,1961.0,Best Show Album (Original Cast),The Sound Of Music (Original Broadway Cast).
66,1961.0,Best Soundtrack Album or Recording of Music Score from Motion Picture or Television,Exodus
67,1961.0,Best Soundtrack Album or Recording of Original Cast from a Motion Picture or TV,Can-Can
68,1961.0,"Best Vocal Performance Album, Female",Mack The Knife - Ella In Berlin.
69,1961.0,"Best Vocal Performance Album, Male",The Genius Of Ray Charles.
70,1961.0,"Best Vocal Performance Single Record Or Track, Female",Mack The Knife.
71,1961.0,"Best Vocal Performance Single Record or Track, Female",Mack The Knife.
72,1961.0,"Best Vocal Performance Single Record or Track, Male",Georgia On My Mind.
73,1961.0,Record of the Year,The Theme From A Summer Place.
74,1961.0,Song of the Year,Theme From Exodus.
75,1962.0,Album Of the Year - Classical,Stravinsky Conducts 1960: Le Sacre Du Printemps; Petrouchka.
76,1962.0,Album of the Year,Judy at Carnegie Hall.
77,1962.0,Best Album Cover (Other Than Classical),Judy At Carnegie Hall.
78,1962.0,Best Album Cover- Classical,Puccini: Madame Butterfly.
79,1962.0,Best Classical Performance- Chamber Music,"Beethoven: Serenade, Op. 8/Kodaly: Duo For Violin And Cello, Op. 7."
80,1962.0,Best Classical Performance- Choral (Other Than Opera),Bach: B Minor Mass.
81,1962.0,Best Classical Performance- Instrumental Soloist (With Orchestra),Bartók: Violin Concerto No. 1.
82,1962.0,Best Classical Performance- Instrumental Soloist Or Duo (Without Orchestra),Reverie For Spanish Guitar.
83,1962.0,Best Classical Performance- Orchestra,Ravel: Daphnis Et Chloe.
84,1962.0,Best Classical Performance- Vocal Soloist (With or Without Orchestra),The Art Of The Prima Donna.
85,1962.0,Best Comedy Performance,An Evening With Mike Nichols And Elaine May.
86,1962.0,Best Contemporary Classical Composition,Stravinsky: Movements For Piano And Orchestra.
87,1962.0,Best Country & Western Recording,Big Bad John.
88,1962.0,Best Documentary or Spoken Word Recording (Other Than Comedy),Humor In Music.
89,1962.0,Best Engineering Contribution - Classical Recording,Ravel: Daphnis Et Chloe.
90,1962.0,Best Engineering Contribution - Novelty,Stan Freberg Presents The United States Of America.
91,1962.0,Best Engineering Contribution - Popular Recording,Judy At Carnegie Hall.
92,1962.0,Best Folk Recording,Belafonte Folk Singers At Home And Abroad.
93,1962.0,Best Gospel Or Other Religious Recording,Everytime I Feel The Spirit.
94,1962.0,Best Instrumental Arrangement,Moon River.
95,1962.0,Best Instrumental Theme Or Instrumental Version of Song,African Waltz.
96,1962.0,Best Jazz Performance - Large Group (Instrumental),West Side Story
97,1962.0,Best Jazz Performance- Soloist or Small Group (Instrumental),Andre Previn Plays Harold Arlen.
98,1962.0,Best New Artist Of 1961,Peter Nero (artist)
99,1962.0,Best Opera Recording,Puccini: Madame Butterfly.
100,1962.0,Best Original Cast Show Album,How To Succeed In Business Without Really Trying.
101,1962.0,Best Original Jazz Composition,African Waltz.
102,1962.0,Best Performance by a Chorus,Great Band With Great Voices.
103,1962.0,Best Performance by a Vocal Group,High Flying.
104,1962.0,Best Performance by an Orchestra - for Other Than Dancing,Breakfast at Tiffany's
105,1962.0,Best Performance by an Orchestra- For Dancing,Up A Lazy River.
106,1962.0,Best Recording for Children,Prokofiev: Peter And The Wolf.
107,1962.0,Best Rhythm & Blues Recording,Hit The Road Jack.
108,1962.0,Best Rock & Roll Recording,Let's Twist Again.
109,1962.0,"Best Solo Vocal Performance, Female",Judy At Carnegie Hall.
110,1962.0,"Best Solo Vocal Performance, Male",Lollipops And Roses.
111,1962.0,Best Soundtrack Album or Recording of Original Cast from Motion Picture or Television,West Side Story
112,1962.0,Best Soundtrack Album or Recording of Score from Motion Picture or Television,Breakfast at Tiffany's
113,1962.0,Record of the Year,Moon River.
114,1962.0,Song of the Year,Moon River.
115,1963.0,Album Of the Year - Classical,Columbia Records Presents Vladimir Horowitz.
116,1963.0,Album of the Year (Other Than Classical),The First Family.
117,1963.0,Best Album Cover- Classical,The Intimate Bach.
118,1963.0,Best Album Cover- Other Than Classical,Lena...Lovely And Alive.
119,1963.0,Best Background Arrangement (Behind Vocalist Or Instrumentalist),I Left My Heart In San Francisco.
120,1963.0,Best Classical Performance- Chamber Music,"The Heifetz-Piatigorsky Concerts With Primrose, Pennario And Guests."
121,1963.0,Best Classical Performance- Choral (Other Than Opera),Bach: St. Matthew Passion.
122,1963.0,Best Classical Performance- Instrumental Soloist Or Duo (Without Orchestra),Columbia Records Presents Vladimir Horowitz.
123,1963.0,Best Classical Performance- Instrumental Soloist Or Soloists (With Orchestra),Stravinsky: Violin Concerto In D.
124,1963.0,Best Classical Performance- Orchestra,Stravinsky: The Firebird Ballet.
125,1963.0,Best Classical Performance- Vocal Soloist (With or Without Orchestra),Wagner: Gotterdamerung - Brunnhilde's Immolation Scene/Wesendonck Songs.
126,1963.0,Best Comedy Performance,The First Family.
127,1963.0,Best Contemporary Composition,Stravinsky: The Flood.
128,1963.0,Best Country & Western Recording,Funny Way Of Laughin'.
129,1963.0,"Best Documentary, Spoken Word, or Drama Recording (Other Than Comedy)",The Story-Teller: A Session With Charles Laughton.
130,1963.0,Best Engineered Recording - Classical,Strauss: Also Sprach Zarathustra.
131,1963.0,Best Engineering Contribution - Novelty,"The Civil War, Vol. I>"
132,1963.0,Best Engineering Contribution - Other than Novelty and Other Than Classical,Hatari.
133,1963.0,Best Folk Recording,If I Had A Hammer.
134,1963.0,Best Gospel Or Other Religious Recording,Great Songs Of Love And Faith.
135,1963.0,Best Instrumental Arrangement,Baby Elephant Walk.
136,1963.0,Best Instrumental Theme,A Taste Of Honey.
137,1963.0,Best Jazz Performance- Large Group (Instrumental),Adventures In Jazz.
138,1963.0,Best Jazz Performance- Soloist or Small Group (Instrumental),Desafinado.
139,1963.0,Best New Artist Of 1962,Robert Goulet (artist)
140,1963.0,Best Opera Recording,Verdi: Aida.
141,1963.0,Best Original Cast Show Album,No Strings.
142,1963.0,Best Original Jazz Composition,Cast Your Fate To The Wind.
143,1963.0,Best Performance by a Chorus,Presenting The New Christy Minstrels.
144,1963.0,Best Performance by a Vocal Group,If I Had A Hammer.
145,1963.0,Best Performance by an Orchestra or Instrumentalist with Orchestra- Primarily Not Jazz Or For Dancing,The Colorful Peter Nero.
146,1963.0,Best Performance by an Orchestra- For Dancing,Fly Me To The Moon Bossa Nova.
147,1963.0,Best Recording for Children,Saint-Saens: Carnival Of The Animals/Britten: Young Person's Guide To The Orchestra.
148,1963.0,Best Rhythm & Blues Recording,I Can't Stop Loving You.
149,1963.0,Best Rock & Roll Recording,Alley Cat.
150,1963.0,"Best Solo Vocal Performance, Female",Ella Swings Brightly With Nelson Riddle.
151,1963.0,"Best Solo Vocal Performance, Male",I Left My Heart In San Francisco.
152,1963.0,Record of the Year,I Left My Heart In San Francisco.
153,1963.0,Song of the Year,What Kind Of Fool Am I.
154,1964.0,Album of the Year (Other Than Classical),The Barbra Streisand Album.
155,1964.0,Best Album Cover- Classical,Puccini: Madama Butterfly.
156,1964.0,Best Album Cover- Other Than Classical,The Barbra Streisand Album.
157,1964.0,Best Album Notes,The Ellington Era.
158,1964.0,Best Background Arrangement (Behind Vocalist Or Instrumentalist),Days Of Wine And Roses.
159,1964.0,Best Classical Composition By A Contemporary Composer,Britten: War Requiem.
160,1964.0,Best Classical Performance- Chamber Music,Evening Of Elizabethan Music.
161,1964.0,Best Classical Performance- Choral (Other Than Opera),Britten: War Requiem.
162,1964.0,Best Classical Performance- Instrumental Soloist Or Duo (Without Orchestra),The Sound Of Horowitz.
163,1964.0,Best Classical Performance- Instrumental Soloist Or Soloists (With Orchestra),Tchaikovsky: Piano Concerto No. 1 In B Flat Minor.
164,1964.0,Best Classical Performance- Orchestra,Bartók: Concerto For Orchestra.
165,1964.0,Best Classical Performance- Vocal Soloist (With or Without Orchestra),Great Scenes From Gershwin's Porgy And Bess.
166,1964.0,Best Comedy Performance,"Hello Mudduh, Hello Faddah."
167,1964.0,Best Country & Western Recording,Detroit City.
168,1964.0,"Best Documentary, Spoken Word, or Drama Recording (Other Than Comedy)",Who's Afraid Of Virginia Woolf?.
169,1964.0,Best Engineered Recording- Classical,Puccini: Madama Butterfly.
170,1964.0,Best Engineered Recording- Other than Classical,Charade.
171,1964.0,Best Engineered Recording- Special or Novel Effects,"The Civil War, Vol. II."
172,1964.0,Best Folk Recording,Blowin' In The Wind.
173,1964.0,Best Gospel Or Other Religious Recording (Musical),Dominique.
174,1964.0,Best Instrumental Arrangement,I Can't Stop Loving You.
175,1964.0,Best Instrumental Jazz Performance- Large Group,"Encore: Woody Herman, 1963."
176,1964.0,Best Instrumental Jazz Performance- Soloist or Small Group,Conversations With Myself.
177,1964.0,Best Instrumental Theme,More - Theme From Mondo Cane.
178,1964.0,Best New Artist Of 1963,Ward Swingle.
179,1964.0,Best Opera Recording,Puccini: Madama Butterfly.
180,1964.0,Best Original Jazz Composition,Gravy Waltz.
181,1964.0,Best Original Score from a Motion Picture or Television Show,Tom Jones
182,1964.0,Best Performance by a Chorus,Bach's Greatest Hits.
183,1964.0,Best Performance by a Vocal Group,Blowin' In The Wind.
184,1964.0,Best Performance by an Orchestra or Instrumentalist with Orchestra- Primarily Not Jazz Or For Dancing,Java.
185,1964.0,Best Performance by an Orchestra- For Dancing,This Time By Basie! Hits Of The 50's And 60's.
186,1964.0,Best Recording for Children,Bernstein Conducts For Young People.
187,1964.0,Best Rhythm & Blues Recording,Busted.
188,1964.0,Best Rock & Roll Recording,Deep Purple.
189,1964.0,Best Score From An Original Cast Show Album,She Loves Me.
190,1964.0,"Best Vocal Performance, Female",The Barbra Streisand Album.
191,1964.0,"Best Vocal Performance, Male",Wives And Lovers.
192,1964.0,Classical Album Of the Year,Britten: War Requiem.
193,1964.0,Most Promising New Classical Recording Artist,Liszt: Concerto No. 1 For Piano & Orchestra.
194,1964.0,Record of the Year,Days Of Wine And Roses.
195,1964.0,Song of the Year,Days Of Wine And Roses.
196,1965.0,Album of the Year,Getz/Gilberto
197,1965.0,Album of the Year -- Classical,Bernstein: Symphony No. 3 Kaddish
198,1965.0,Best Accompaniment Arrangement for Vocalist(s) or Instrumentalist(s),People
199,1965.0,Best Album Cover- Other Than Classical,People
200,1965.0,Best Album Notes,Mexico (Legacy Collection)
201,1965.0,Best Chamber Music Performance - Vocal,It Was A Lover And His Lass
202,1965.0,Best Chamber Performance - Instrumental,"Beethoven: Trio No. 1 In E Flat, Op. 1 #1"
203,1965.0,Best Choral Performance (other than opera),Britten: A Ceremony Of Carols
204,1965.0,Best Comedy Performance,I Started Out as a Child
205,1965.0,Best Composition by a Contemporary Composer,Barber: Piano Concerto
206,1965.0,Best Country & Western Album,Dang Me/Chug-A-Lug
207,1965.0,Best Country & Western Single,Dang Me
208,1965.0,Best Country & Western Song,Dang Me
209,1965.0,Best Country & Western Vocal Performance - Female,Here Comes My Baby
210,1965.0,Best Country & Western Vocal Performance - Male,Dang Me
211,1965.0,"Best Documentary, Spoken Word or Drama Recording (other than comedy)","BBC Tribute To John F. Kennedy (That Was The Week That Was, Cast)"
212,1965.0,Best Engineered Recording,Britten: Young Person's Guide To The Orchestra
213,1965.0,Best Engineered Recording - Non-Classical,Getz/Gilberto
214,1965.0,Best Engineered Recording - Special or Novel Effects,The Chipmunks Sing The Beatles
215,1965.0,Best Folk Recording,We'll Sing In The Sunshine
216,1965.0,Best Gospel or Other Religious Recording (Musical),Great Gospel Songs
217,1965.0,Best Instrumental Arrangement,The Pink Panther
218,1965.0,Best Instrumental Composition (other than jazz),The Pink Panther Theme
219,1965.0,Best Instrumental Jazz Performance - Large Group or Soloist with Large Group,Guitar From Ipanema
220,1965.0,Best Instrumental Jazz Performance - Small Group or Soloist with Small Group,Getz/Gilberto
221,1965.0,Best Instrumental Performance - Non-Jazz,The Pink Panther
222,1965.0,Best New Artist,The Beatles (artist)
223,1965.0,Best Opera Recording,Bizet: Carmen
224,1965.0,Best Original Jazz Composition,The Cat
225,1965.0,Best Original Score Written for a Motion Picture or Television Show,Mary Poppins
226,1965.0,Best Performance - Instrumental Soloist or Soloists (with orchestra),Prokofiev: Violin Concerto No. 1 In D
227,1965.0,Best Performance - Instrumental Soloist or Soloists (without orchestra),"Vladimir Horowitz Plays Beethoven, Debussy, Chopin"
228,1965.0,Best Performance - Orchestra,Mahler: Symphony No. 5/Berg: Wozzeck Excerpts
229,1965.0,Best Performance by a Chorus,The Swingle Singers Going Baroque
230,1965.0,Best Performance by a Vocal Group,A Hard Day's Night
231,1965.0,Best Recording for Children,Mary Poppins
232,1965.0,Best Rhythm & Blues Recording,How Glad I Am
233,1965.0,Best Rock & Roll Recording,Downtown
234,1965.0,Best Score From an Original Cast Show Album,Funny Girl
235,1965.0,"Best Vocal Performance, Female",People
236,1965.0,"Best Vocal Performance, Male","Hello, Dolly!"
237,1965.0,Best Vocal Soloist Performance (with or without orchestra),Berlioz: Nuits D'Ete (Song Cycle)/Falla: El Amor Brujo
238,1965.0,Most Promising New Classical Recording Artist,"The Age Of Bel Canto: Operatic Scenes (Boyngne, cond.)"
239,1965.0,Record of the Year,The Girl From Ipanema
240,1965.0,Song of the Year,"Hello, Dolly!"
241,1966.0,Album of the Year,September Of My Years
242,1966.0,Album of the Year - Classical,Horowitz At Carnegie Hall - An Historic Return
243,1966.0,Best Album Cover - Graphic Arts,Bartók: Concerto No. 2 For Violin/Stravinsky: Concerto For Violin
244,1966.0,Best Album Cover - Photography,Jazz Suite On The Mass Texts
245,1966.0,Best Album Notes,September Of My Years
246,1966.0,Best Arrangement Accompanying a Vocalist or Instrumentalist,It Was A Very Good Year
247,1966.0,Best Classical Chamber Music Performance - Instrumental or Vocal,Bartók: The Six String Quartets - Nos. 1-6
248,1966.0,Best Classical Choral Performance (other than opera),Stravinsky: Symphony Of Psalms/Poulenc: Gloria
249,1966.0,Best Classical Performance - Instrumental Soloist or Soloists (with orchestra),Beethoven: Piano Concerto No. 4 In G
250,1966.0,Best Classical Performance - Instrumental Soloist or Soloists (without orchestra),Horowitz At Carnegie Hall - An Historic Return
251,1966.0,Best Classical Performance - Orchestra,Ives: Symphony No. 4
252,1966.0,Best Classical Vocal Soloist Performance,"Strauss: Salome (Dance Of The Seven Veils, Interlude, Final Scene)/The Egyptian Helen (Awakening Scene)"
253,1966.0,Best Comedy Performance,Why Is There Air?
254,1966.0,Best Composition by a Contemporary Classical Composer,Ives: Symphony No. 4
255,1966.0,Best Contemporary (R&R) Performance - Group (Vocal or Instrumental),Flowers On The Wall
256,1966.0,Best Contemporary (R&R) Single,King Of The Road
257,1966.0,Best Contemporary (R&R) Vocal Performance - Female,I Know A Place
258,1966.0,Best Contemporary (R&R) Vocal Performance - Male,King Of The Road
259,1966.0,Best Country & Western Album,The Return Of Roger Miller
260,1966.0,Best Country & Western Single,King Of The Road
261,1966.0,Best Country & Western Song,King Of The Road
262,1966.0,Best Country & Western Vocal Performance - Female,Queen Of The House
263,1966.0,Best Country & Western Vocal Performance - Male,King Of The Road
264,1966.0,Best Engineered Recording - Non-Classical,A Taste Of Honey
265,1966.0,"Best Engineered Recording, Classical",Horowitz At Carnegie Hall - An Historic Return
266,1966.0,Best Folk Recording,An Evening With Belafonte/Makeba
267,1966.0,Best Gospel or Other Religious Recording (Musical),Southland Favorites
268,1966.0,Best Instrumental Arrangement,A Taste Of Honey
269,1966.0,Best Instrumental Jazz Performance - Large Group or Soloist with Large Group,Ellington '66
270,1966.0,Best Instrumental Jazz Performance - Small Group or Soloist With Small Group,The In Crowd
271,1966.0,"Best Instrumental Performance, Non-Jazz",A Taste Of Honey
272,1966.0,Best New Artist,Tom Jones
273,1966.0,Best Opera Recording,Berg: Wozzeck
274,1966.0,Best Original Jazz Composition,Jazz Suite On The Mass Texts
275,1966.0,Best Original Score Written for a Motion Picture or Television Show,The Sandpiper
276,1966.0,Best Performance by a Chorus,Anyone For Mozart?
277,1966.0,Best Performance by a Vocal Group,We Dig Mancini
278,1966.0,Best Recording for Children,Dr. Seuss Presents Fox In Sox And Green Eggs And Ham
279,1966.0,Best Rhythm & Blues Recording,Papa's Got A Brand New Bag
280,1966.0,Best Score From an Original Cast Show Album,On A Clear Day
281,1966.0,Best Spoken Word or Drama Recording,John F. Kennedy - As We Remember Him
282,1966.0,"Best Vocal Performance, Female",My Name Is Barbra
283,1966.0,"Best Vocal Performance, Male",It Was A Very Good Year
284,1966.0,Most Promising New Classical Recording Artist,Bach: Goldberg Variations
285,1966.0,Record of the Year,A Taste Of Honey
286,1966.0,Song of the Year,The Shadow Of Your Smile (Love Theme From The Sandpiper)
287,1967.0,Album of the Year,A Man And His Music
288,1967.0,Album of the Year - Classical,Ives: Symphony No. 1 In D Minor
289,1967.0,"Best Album Cover, Photography",Confessions Of A Broken Man
290,1967.0,Best Album Notes,Sinatra At The Sands
291,1967.0,Best Arrangement Accompanying a Vocalist or Instrumentalist,Strangers In The Night
292,1967.0,Best Chamber Music Performance - Instrumental or Vocal,"Boston Symphony Chamber Players - Works Of Mozart, Brahms, Beethoven, Fine, Copland, Carter, Piston"
293,1967.0,Best Classical Choral Performance (other than opera),Ives: Music For Chorus
294,1967.0,Best Classical Performance - Instrumental Soloist or Soloists (with or without orchestra),"Baroque Guitar (Works Of Bach, Sanz, Weiss, Etc.)"
295,1967.0,Best Classical Performance - Orchestra,Mahler: Symphony No. 6 In A Minor
296,1967.0,Best Classical Vocal Soloist Performance (with or without orchestra),"Prima Donna (Works Of Barber, Purcell, Etc.)"
297,1967.0,Best Comedy Performance,Wonderfulness
298,1967.0,"Best Contemporary (R&R) Group Performance, Vocal or Instrumental","Monday, Monday"
299,1967.0,Best Contemporary (R&R) Recording,Winchester Cathedral
300,1967.0,Best Contemporary (R&R) Solo Vocal Performance - Male or Female,Eleanor Rigby
301,1967.0,Best Country & Western Recording,Almost Persuaded
302,1967.0,Best Country & Western Song,Almost Persuaded
303,1967.0,Best Country & Western Vocal Performance - Female,Don't Touch Me
304,1967.0,"Best Country & Western Vocal Performance, Male",Almost Persuaded
305,1967.0,Best Engineered Recording - Classical,Wagner: Lohengrin
306,1967.0,Best Engineered Recording - Non-Classical,Strangers In The Night
307,1967.0,Best Folk Recording,Blues In The Street
308,1967.0,Best Instrumental Arrangement,What Now My Love
309,1967.0,Best Instrumental Jazz Performance - Group or Soloist with Group,Goin' Out Of My Head
310,1967.0,Best Instrumental Performance (Other Than Jazz),What Now My Love
311,1967.0,Best Instrumental Theme,Batman Theme
312,1967.0,Best Opera Recording,Wagner: Die Walkure
313,1967.0,Best Original Jazz Composition,In The Beginning God
314,1967.0,Best Original Score Written for a Motion Picture or Television Show,Doctor Zhivago
315,1967.0,Best Performance by a Chorus,Somewhere My Love (Lara's Theme From Dr. Zhivago)
316,1967.0,Best Performance by a Vocal Group,A Man And A Woman
317,1967.0,Best Recording for Children,Dr. Seuss Presents - If I Ran The Zoo And Sleep Book
318,1967.0,"Best Rhythm & Blues Group Performance, Vocal or Instrumental",Hold It Right There
319,1967.0,Best Rhythm & Blues Recording,Crying Time
320,1967.0,"Best Rhythm & Blues Solo Vocal Performance, Male or Female",Crying Time
321,1967.0,Best Sacred Performance,Elvis Presley
322,1967.0,Best Sacred Recording (Musical),Grand Old Gospel
323,1967.0,Best Score From an Original Cast Show Album,Mame
324,1967.0,"Best Spoken Word, Documentary or Drama Recording",Edward R. Murrow - A Reporter Remembers Vol. I The War Years
325,1967.0,"Best Vocal Performance, Female",If He Walked Into My Life
326,1967.0,"Best Vocal Performance, Male",Strangers In The Night
327,1967.0,Record of the Year,Strangers In The Night
328,1967.0,Song of the Year,Michelle
329,1968.0,Album of the Year,Sgt. Pepper's Lonely Hearts Club Band
330,1968.0,"Album of the Year, Classical",Mahler: Symphony No. 8 (Symphony Of A Thousand)
331,1968.0,"Best Album Cover, Graphic Arts",Sgt. Pepper's Lonely Hearts Club Band
332,1968.0,"Best Album Cover, Photography",Bob Dylan's Greatest Hits
333,1968.0,Best Album Notes,Suburban Attitudes In Country Verse
334,1968.0,Best Arrangement Accompanying Vocalist(s) or Instrumentalist(s),Ode To Billie Joe
